"Key"	"English"	"Welsh"	Added.
"checkYourAnswers.title"	"Check your answers before sending your information"	"Gwiriwch eich atebion cyn anfon eich gwybodaeth"	Added.
"checkYourAnswers.amend.title"	"Check your additional information"	"Gwriwch eich gwybodaeth ychwanegol"	Added.
"checkYourAnswers.heading"	"Check Your Answers"	"Gwiriwch eich atebion"	Added.
"checkYourAnswers.guidance"	"Guidance for check your answers"		Added.
"checkYourAnswers.missing.icon"	"Warning"	"Rhybudd"	Added.
"checkYourAnswers.missing.warning"	"Some information is missing. This must be completed before sending your application."	"Mae rhywfaint o wybodaeth ar goll. Rhaid llenwi hyn cyn anfon eich cais."	Added.
"checkYourAnswers.missing.subheading"	"Some information is missing"	"Mae rhywfaint o wybodaeth ar goll"	Added.
"checkYourAnswers.missing.paragraph"	"Please review your answers above and complete any missing information. Alternatively, you can use the button below."	"Edrychwch dros eich atebion uchod ac ychwanegwch unrhyw wybodaeth sydd ar goll. Fel arall, gallwch ddefnyddio’r botwm isod."	Added.
"checkYourAnswers.missing.resolve.link"	"Resolve missing answers"	"Datrys yr atebion sydd ar goll"	Added.
"checkYourAnswers.missing.resolve"	"Resolve missing answers"	"Datrys yr atebion sydd ar goll"	Added.
"checkYourAnswers.submit.heading"	"Send your application"	"Anfon eich cais"	Added.
"checkYourAnswers.submit.before.send"	"Before you send your application, ensure that you have fully reviewed the information you have provided and that it is correct."	"Cyn i chi anfon eich cais, gwnewch yn siŵr eich bod wedi adolygu’r holl wybodaeth rydych wedi’i rhoi a’i bod yn gywir."	Added.
"checkYourAnswers.submit.print"	"You can print a summary of your application on the next page."	"Gallwch argraffu crynodeb o’ch cais ar y dudalen nesaf."	Added.
"site.switchLanguage"	"Newid yr iaith i’r Gymraeg"	"Change the language to English"	Added.
"date.day"	"Day"	"Diwrnod"	Added.
"date.month"	"Month"	"Mis"	Added.
"date.year"	"Year"	"Blwyddyn"	Added.
"error.browser.title.prefix"	"Error:"	"Gwall:"	Added.
"error.boolean"	"Please give an answer"	"Rhowch ateb"	Added.
"error.invalid_date"	"Give a correct date"	"Rhowch ddyddiad cywir"	Added.
"error.integer"	"Give an answer in whole numbers"	"Rhowch ateb mewn rhifau cyfain"	Added.
"error.non_numeric"	"Give a value using only numbers"	"Rhowch werth gan ddefnyddio rhifau yn unig"	Added.
"error.number"	"Please enter a valid number"	"Nodwch rif dilys"	Added.
"error.required"	"Please enter a value"	"Nodwch werth"	Added.
"error.summary.title"	"There is a problem"	"Mae problem wedi codi"	Added.
"index.title"	"Apply for repayment of import duty and import VAT"	"Gwneud cais am ad-daliad o dollau mewnforio a TAW mewnforio"	Added.
"index.heading"	"Apply for repayment of import duty and import VAT"	"Gwneud cais am ad-daliad o dollau mewnforio a TAW mewnforio"	Added.
"index.guidance"	"Welcome to your new frontend. Please see the README file for a guide to getting started."		Added.
"session_expired.title"	"For your security, we signed you out"	"Er eich diogelwch, gwnaethom eich allgofnodi"	Added.
"session_expired.heading"	"For your security, we signed you out"	"Er eich diogelwch, gwnaethom eich allgofnodi"	Added.
"session_expired.guidance"	"We did not save your answers."	"Ni wnaethom gadw’ch atebion."	Added.
"session_expired.button"	"Sign in"	"Mewngofnodi"	Added.
"timeout.title"	"For your security, we will sign you out"	"Er eich diogelwch, byddwn yn eich allgofnodi"	Added.
"timeout.message"	"For your security, we will sign you out in $"	"Er eich diogelwch, byddwn yn eich allgofnodi ymhen $"	Added.
"timeout.keepAlive"	"Stay signed in"	"Parhau i fod wedi’ch mewngofnodi"	Added.
"timeout.signOut"	"Sign out"	"Allgofnodi"	Added.
"site.back"	"Back"	"Yn ôl"	Added.
"site.delete"	"Remove"	"Tynnu"	Added.
"site.edit"	"Change"	"Newid"	Added.
"site.hidden-delete"	"Delete {0}"	"Dileu {0}"	Added.
"site.hidden-edit"	"Change {0}"	"Newid {0}"	Added.
"site.no"	"No"	"Na"	Added.
"site.yes"	"Yes"	"Iawn"	Added.
"site.continue"	"Continue"	"Yn eich blaen"	Added.
"find.address"	"Find address"	"Dod o hyd i gyfeiriad"	Added.
"site.service_name"	"Apply for repayment of import duty and import VAT"	"Gwneud cais am ad-daliad o dollau mewnforio a TAW mewnforio"	Added.
"site.textarea.char_limit"	"(Limit is {0} characters)"	"(Y terfyn yw {0} o gymeriadau)"	Added.
"site.govuk"	"GOV.UK"	"GOV.UK/CYMRAEG"	Added.
"footer.cookies"	"Cookies"	"Cwcis"	Added.
"footer.privacy"	"Privacy policy"	"Polisi preifatrwydd"	Added.
"footer.termsConditions"	"Terms and conditions"	"Telerau ac amodau"	Added.
"footer.govukHelp"	"Help using GOV.UK"	"Help wrth ddefnyddio GOV.UK"	Added.
"footer.accessibilityStatement"	"Accessibility statement"	"Datganiad hygyrchedd"	Added.
"unauthorised.title"	"You can’t access this service with this account"	"Ni allwch ddefnyddio’r gwasanaeth hwn gyda’r cyfrif hwn"	Added.
"unauthorised.heading"	"You can’t access this service with this account"	"Ni allwch ddefnyddio’r gwasanaeth hwn gyda’r cyfrif hwn"	Added.
"importerHasEori.title"	"Do you have an EORI number?"	"A oes gennych rif EORI?"	Added.
"importerHasEori.heading"	"Do you have an EORI number?"	"A oes gennych rif EORI?"	Added.
"importerHasEori.checkYourAnswersLabel"	"Do you have an EORI number?"	"A oes gennych rif EORI?"	Added.
"importerHasEori.error.required"	"Select yes if you have an EORI number"	"Dewiswch ‘Iawn’ os oes gennych rif EORI"	Added.
"claimantType.title"	"Are you the importer or their representative?"	"Ai’r mewnforiwr neu gynrychiolydd y mewnforiwr ydych chi?"	Added.
"claimantType.heading"	"Are you the importer or their representative?"	"Ai’r mewnforiwr neu gynrychiolydd y mewnforiwr ydych chi?"	Added.
"claimantType.01"	"I am the importer"	"Y mewnforiwr ydw i"	Added.
"claimantType.02"	"I am a representative of the importer"	"Cynrychiolydd y mewnforiwr ydw i"	Added.
"claimantType.checkYourAnswersLabel"	"Are you the importer or representative?"	"Ai’r mewnforiwr neu’r cynrychiolydd ydych chi?"	Added.
"claimantType.error.required"	"Select if you are the importer or a representative of the importer"	"Dewiswch ai chi yw’r mewnforiwr neu gynrychiolydd y mewnforiwr"	Added.
"claimantType.importer"	"Importer"	"Mewnforiwr"	Added.
"claimantType.representative"	"Representative"	"Cynrychiolydd"	Added.
"impInfo.checkYourAnswersLabel"	"Import information"	"Gwybodaeth fewnforio"	Added.
"importerEori.title"	"What is your EORI number?"	"Beth yw’ch rhif EORI?"	Added.
"importerEori.heading"	"What is your EORI number?"	"Beth yw’ch rhif EORI?"	Added.
"importerEori.checkYourAnswersLabel"	"Your EORI number"	"Eich rhif EORI"	Added.
"importerEori.error.invalid"	"Enter your EORI number"	"Nodwch eich rhif EORI"	Added.
"isVATRegistered.title"	"Are you VAT registered?"	"A ydych wedi’ch cofrestru ar gyfer TAW?"	Added.
"isVATRegistered.heading"	"Are you VAT registered?"	"A ydych wedi’ch cofrestru ar gyfer TAW?"	Added.
"isVATRegistered.01"	"Yes"	"Iawn"	Added.
"isVATRegistered.02"	"No"	"Na"	Added.
"isVATRegistered.checkYourAnswersLabel"	"Are you VAT registered?"	"A ydych wedi’ch cofrestru ar gyfer TAW?"	Added.
"isVATRegistered.error.required"	"Select yes if you are VAT registered"	"Dewiswch ‘Iawn’ os ydych wedi’ch cofrestru ar gyfer TAW"	Added.
"isVATRegistered.details.header"	"Help with VAT registration"	"Help gyda chofrestru ar gyfer TAW"	Added.
"isVATRegistered.details.p1"	"You must register your business for VAT with HMRC if its VAT taxable turnover is over the current VAT registration threshold."	"Mae’n rhaid i chi gofrestru’ch busnes ar gyfer TAW gyda CThEM os yw ei drosiant trethadwy TAW dros y trothwy cofrestru TAW presennol."	Added.
"isVATRegistered.details.p2"	"You can register voluntarily if your turnover is under the threshold, unless everything you sell is exempt."	"Gallwch gofrestru’n wirfoddol os yw’ch trosiant o dan y trothwy, oni bai bod popeth yr ydych yn ei werthu wedi’i eithrio."	Added.
"importerClaimantVrn.title"	"What is your VRN number?"	"Beth yw’ch Rhif Cofrestru TAW (VRN)?"	Added.
"importerClaimantVrn.heading"	"What is your VRN number?"	"Beth yw’ch Rhif Cofrestru TAW (VRN)?"	Added.
"importerClaimantVrn.checkYourAnswersLabel"	"What is your VRN number?"	"Beth yw’ch Rhif Cofrestru TAW (VRN)?"	Added.
"importerClaimantVrn.error.required"	"Enter your VRN number"	"Nodwch eich rhif VRN"	Added.
"importerClaimantVrn.error.length"	"VRN number must be 9 characters or less"	"Mae’n rhaid i’r rhif VRN fod yn 9 o gymeriadau neu lai"	Added.
"customsRegulationType.title"	"What was the entry acceptance date?"	"Beth oedd y dyddiad derbyn ar gyfer y cofnod?"	Added.
"customsRegulationType.heading"	"What was the entry acceptance date?"	"Beth oedd y dyddiad derbyn ar gyfer y cofnod?"	Added.
"customsRegulationType.importer"	"You can find this on the E2 document under &#8216;Entry Acceptance Details&#x2019;, or by asking your shipping agent or courier."	"Gallwch ddod o hyd i hyn yn y ddogfen E2 o dan &#8216;Manylion Derbyn y Cofnod&#x2019; (‘Entry Acceptance Details’), neu drwy ofyn i’ch asiant cludo neu’ch cludwr."	Added.
"customsRegulationType.representative"	"You can find this on the E2 document."	"Gallwch ddod o hyd i hyn yn y ddogfen E2."	Added.
"customsRegulationType.01"	"On or before 31 December 2020"	"Ar neu cyn 31 Rhagfyr 2020"	Added.
"customsRegulationType.02"	"From 1 January 2021"	"O 1 Ionawr 2021 ymlaen"	Added.
"customsRegulationType.checkYourAnswersLabel"	"Acceptance date"	"Dyddiad derbyn"	Added.
"customsRegulationType.error.required"	"Select an option to continue"	"Dewiswch opsiwn i fynd yn eich blaen"	Added.
"articleType.title"	"Why are you applying for this repayment?"	"Pam yr ydych yn gwneud cais am yr ad-daliad hwn?"	Added.
"articleType.heading"	"Why are you applying for this repayment?"	"Pam yr ydych yn gwneud cais am yr ad-daliad hwn?"	Added.
"articleType.117"	"Overpayment of duty or VAT (Article 117)"	"Gordaliad o doll neu TAW (Erthygl 117)"	Added.
"articleType.119"	"Error by customs (Article 119)"	"Gwall ar ran yr awdurdodau tollau (Erthygl 119)"	Added.
"articleType.120"	"Exceptional circumstances (Article 120)"	"Amgylchiadau eithriadol (Erthygl 120)"	Added.
"articleType.checkYourAnswersLabel"	"Reason for application"	"Rheswm dros wneud cais"	Added.
"articleType.error.required"	"Select the reason you are applying for this repayment"	"Dewiswch y rheswm dros wneud cais am yr ad-daliad hwn"	Added.
"ukRegulationType.title"	"Why are you applying for this repayment?"	"Pam yr ydych yn gwneud cais am yr ad-daliad hwn?"	Added.
"ukRegulationType.heading"	"Why are you applying for this repayment?"	"Pam yr ydych yn gwneud cais am yr ad-daliad hwn?"	Added.
"ukRegulationType.048"	"Error by Customs (Regulation 48)"	"Gwall ar ran yr awdurdodau tollau (Rheoliad 48)"	Added.
"ukRegulationType.049"	"Lower rate was applicable (Regulation 49)"	"Roedd cyfradd is yn berthnasol (Rheoliad 49)"	Added.
"ukRegulationType.050"	"Overpayment of duty or VAT (Regulation 50)"	"Gordaliad o doll neu TAW (Rheoliad 50)"	Added.
"ukRegulationType.051"	"Rejected (Regulation 51)"	"Fe’i gwrthodwyd (Rheoliad 51)"	Added.
"ukRegulationType.052"	"Special circumstances (Regulation 52)"	"Amgylchiadau arbennig (Rheoliad 52)"	Added.
"ukRegulationType.053"	"Withdrawal of customs declaration (Regulation 53)"	"Tynnu datganiad tollau yn ôl (Rheoliad 53)"	Added.
"ukRegulationType.checkYourAnswersLabel"	"Reason for application"	"Rheswm dros wneud cais"	Added.
"ukRegulationType.error.required"	"Select why you are applying for this repayment"	"Dewiswch pam yr ydych yn gwneud cais am yr ad-daliad hwn"	Added.
"numberOfEntriesType.title"	"How many entries do you want to submit?"	"Faint o gofnodion yr ydych am eu cyflwyno?"	Added.
"numberOfEntriesType.heading"	"How many entries do you want to submit?"	"Faint o gofnodion yr ydych am eu cyflwyno?"	Added.
"numberOfEntriesType.hint"	"Multiple entries must be from the same importer, and have the same reason for overpayment."	"Mae’n rhaid i gofnodion lluosog ddod o’r un mewnforiwr ac mae’n rhaid iddynt gynnwys yr un rheswm dros ordalu."	Added.
"numberOfEntriesType.01"	"One entry"	"Un cofnod"	Added.
"numberOfEntriesType.02"	"Multiple entries"	"Cofnodion lluosog"	Added.
"numberOfEntriesType.02.hint"	"Number of entries"	"Nifer y cofnodion"	Added.
"numberOfEntriesType.checkYourAnswersLabel"	"How many entries do you want to submit?"	"Faint o gofnodion yr ydych am eu cyflwyno?"	Added.
"numberOfEntriesType.single.checkYourAnswersLabel"	"One entry"	"Un cofnod"	Added.
"numberOfEntriesType.multiple.checkYourAnswersLabel"	"Multiple entries"	"Cofnodion lluosog"	Added.
"numberOfEntriesType.error.required"	"Select if you want to submit one entry or more than one entry"	"Dewiswch a ydych am gyflwyno un cofnod neu fwy nag un cofnod"	Added.
"howManyEntries.title"	"How many entries are you claiming for?"	"Faint o gofnodion yr ydych yn hawlio ar eu cyfer?"	Added.
"howManyEntries.heading"	"How many entries are you claiming for?"	"Faint o gofnodion yr ydych yn hawlio ar eu cyfer?"	Added.
"howManyEntries.checkYourAnswersLabel"	"Number of entries"	"Nifer y cofnodion"	Added.
"howManyEntries.error.required"	"Enter the number of entries you are claiming for"	"Nodwch nifer y cofnodion rydych yn hawlio ar eu cyfer"	Added.
"howManyEntries.error.length"	"The number of entries must be between 2 and 999,999"	"Mae’n rhaid i nifer y cofnodion fod rhwng 2 a 999,999"	Added.
"entryDetails.single.title"	"Add the details for this entry"	"Ychwanegwch y manylion ar gyfer y cofnod hwn"	Added.
"entryDetails.multiple.title"	"Enter the details of the oldest entry"	"Nodwch fanylion y cofnod hynaf"	Added.
"entryDetails.single.heading"	"Add the details for this entry"	"Ychwanegwch y manylion ar gyfer y cofnod hwn"	Added.
"entryDetails.multiple.heading"	"Enter the details of the oldest entry"	"Nodwch fanylion y cofnod hynaf"	Added.
"entryDetails.importer.hint"	"These can be found in box 1 of the C88 document, or by asking your shipping agent or courier."	"Gellir dod o hyd i’r rhain ym mlwch 1 yn y ddogfen C88, neu drwy ofyn i’ch asiant cludo neu’ch cludwr amdanynt"	Added.
"entryDetails.representative.hint"	"These can be found on the C88 document."	"Gellir dod o hyd i’r rhain yn y ddogfen C88."	Added.
"entryDetails.claimEpu.heading"	"Entry processing unit (EPU) number"	"Rhif yr Uned Prosesu Cofnodion (EPU)"	Added.
"entryDetails.claimEpu.hint"	"This is 3 numbers, for example 131."	"Rhif 3 digid yw hwn, er enghraifft 131."	Added.
"entryDetails.claimEpu.error.required"	"Enter the entry processing unit (EPU) number"	"Nodwch rif yr Uned Prosesu Cofnodion (EPU)"	Added.
"entryDetails.claimEpu.error.valid"	"Enter a three digit entry processing unit (EPU) number"	"Nodwch rif Uned Prosesu Cofnodion (EPU) tri digid"	Added.
"entryDetails.entryNumber.heading"	"Entry number"	"Rhif y cofnod"	Added.
"entryDetails.entryNumber.hint"	"This is 6 numbers and a letter, for example 123456Q."	"Mae hwn yn cynnwys 6 rhif a llythyren, er enghraifft 123456Q."	Added.
"entryDetails.entryNumber.error.required"	"Enter the entry number"	"Nodwch rif y cofnod"	Added.
"entryDetails.entryNumber.error.valid"	"Enter a valid entry number"	"Nodwch rif cofnod dilys"	Added.
"entryDetails.entryDate.heading"	"Entry date"	"Dyddiad y cofnod"	Added.
"entryDetails.entryDate.hint"	"For example, 25 3 2019."	"Er enghraifft, 25 3 2019."	Added.
"entryDetails.claimEntryDate.error.required"	"Enter the entry date"	"Nodwch ddyddiad y cofnod"	Added.
"entryDetails.claimEntryDate.error.invalid"	"Enter the entry date in the correct format"	"Nodwch ddyddiad y cofnod yn y fformat cywir"	Added.
"entryDetails.claimEntryDate.error.invalid_future"	"The entry date must be today or in the past"	"Mae’n rhaid i ddyddiad y cofnod fod heddiw neu yn y gorffennol"	Added.
"error.date.day_blank"	"Entry date must include a day"	"Mae’n rhaid i ddyddiad y cofnod gynnwys diwrnod"	Added.
"error.date.day_invalid"	"Enter the day in the correct format"	"Nodwch y diwrnod yn y fformat cywir"	Added.
"error.date.month_blank"	"Entry date must include a month"	"Mae’n rhaid i ddyddiad y cofnod gynnwys mis"	Added.
"error.date.month_invalid"	"Enter the month in the correct format"	"Nodwch y mis yn y fformat cywir"	Added.
"error.date.year_blank"	"Entry date must include a year"	"Mae’n rhaid i ddyddiad y cofnod gynnwys blwyddyn"	Added.
"error.date.year_invalid"	"Enter the year in the correct format"	"Nodwch y flwyddyn yn y fformat cywir"	Added.
"error.date.all"	"Entry date must be a real date"	"Mae’n rhaid i ddyddiad y cofnod fod yn ddyddiad go iawn"	Added.
"error.date.day_month"	"Entry date must include a day and month"	"Mae’n rhaid i ddyddiad y cofnod gynnwys diwrnod a mis"	Added.
"error.date.day_year"	"Entry date must include a day and year"	"Mae’n rhaid i ddyddiad y cofnod gynnwys diwrnod a blwyddyn"	Added.
"error.date.month_year"	"Entry date must include a month and year"	"Mae’n rhaid i ddyddiad y cofnod gynnwys mis a blwyddyn"	Added.
"entryDetails.checkYourAnswersLabel"	"Entry information"	"Gwybodaeth am y cofnod"	Added.
"entryDetails.epu.checkYourAnswersLabel"	"EPU number"	"Rhif EPU"	Added.
"entryDetails.number.checkYourAnswersLabel"	"Entry number"	"Rhif y cofnod"	Added.
"entryDetails.date.checkYourAnswersLabel"	"Entry date"	"Dyddiad y cofnod"	Added.
"claimEntryNumber.checkYourAnswersLabel"	"What is the entry number?"	"Beth yw rhif y cofnod?"	Added.
"claimEntryDate.checkYourAnswersLabel"	"What was the entry date?"	"Beth oedd dyddiad y cofnod?"	Added.
"applicationInformation.checkYourAnswersLabel"	"Application information"	"Gwybodaeth am y cais"	Added.
"claimReasonType.title"	"What does your application relate to?"	"Beth mae’ch cais yn ymwneud ag ef?"	Added.
"claimReasonType.heading"	"What does your application relate to?"	"Beth mae’ch cais yn ymwneud ag ef?"	Added.
"claimReasonType.01"	"Retroactive quota"	"Cwota ôl-weithredol"	Added.
"claimReasonType.02"	"Customs procedure code change"	"Newid i’r cod gweithdrefnau tollau"	Added.
"claimReasonType.03"	"Currency change"	"Newid i’r arian cyfred"	Added.
"claimReasonType.04"	"Commodity code change"	"Newid i’r cod nwyddau"	Added.
"claimReasonType.05"	"Customs special procedures"	"Gweithdrefnau arbennig y tollau"	Added.
"claimReasonType.06"	"Preference"	"Ffafriaeth"	Added.
"claimReasonType.07"	"Returned goods relief"	"Rhyddhad ar nwyddau a ddychwelwyd"	Added.
"claimReasonType.08"	"Return of unwanted goods"	"Dychwelyd nwyddau nad oes eu hangen"	Added.
"claimReasonType.09"	"Value"	"Gwerth"	Added.
"claimReasonType.10"	"Something not listed"	"Rhywbeth heb ei restru"	Added.
"claimReasonType.or"	"or"	"neu"	Added.
"claimReasonType.checkYourAnswersLabel"	"Reason for overpayment"	"Rheswm dros y gordaliad"	Added.
"claimReasonType.error.required"	"Select what your application relates to"	"Dewiswch beth mae’ch cais yn ymwneud ag ef"	Added.
"reasonForOverpayment.title"	"Tell us why the overpayment happened"	"Dywedwch wrthym pam y digwyddodd y gordaliad"	Added.
"reasonForOverpayment.heading"	"Tell us why the overpayment happened"	"Dywedwch wrthym pam y digwyddodd y gordaliad"	Added.
"reasonForOverpayment.checkYourAnswersLabel"	"Why the overpayment happened"	"Pam y digwyddodd y gordaliad"	Added.
"reasonForOverpayment.error.required"	"Tell us why the overpayment happened"	"Dywedwch wrthym pam y digwyddodd y gordaliad"	Added.
"reasonForOverpayment.error.length"	"Overpayment reason must be 1200 characters or less"	"Mae’n rhaid i’r rheswm dros y gordaliad fod yn 1200 o gymeriadau neu lai"	Added.
"reasonForOverpayment.hint"	"If you do not provide enough information, we may be unable to process your application."	"Os na fyddwch yn rhoi digon o wybodaeth, mae’n bosibl na fyddwn yn gallu prosesu’ch cais."	Added.
"reasonForOverpayment.p1"	"You can tell us about:"	"Gallwch roi gwybod i ni am:"	Added.
"reasonForOverpayment.bullet1"	"any commodity codes"	"unrhyw godau nwyddau"	Added.
"reasonForOverpayment.bullet2"	"changes in currency or exchange rates"	"newidiadau mewn arian cyfred neu gyfraddau cyfnewid"	Added.
"reasonForOverpayment.bullet3"	"changes to customs procedures"	"newidiadau mewn gweithdrefnau tollau"	Added.
"reasonForOverpayment.bullet4"	"any preferential rates or schemes that applied"	"unrhyw gynlluniau neu gyfraddau ffafriol a oedd yn berthnasol"	Added.
"reasonForOverpayment.bullet5"	"whether any items were replaced or refunded, and why"	"p’un a gafodd unrhyw eitemau eu newid neu eu had-dalu, a pham"	Added.
"reasonForOverpayment.bullet6"	"changes to the value of goods"	"newidiadau i werth nwyddau"	Added.
"reasonForOverpayment.bullet7"	"the number of items or goods"	"nifer yr eitemau neu’r nwyddau"	Added.
"reasonForOverpayment.bullet8"	"a description of the items or goods"	"disgrifiad o’r eitemau neu’r nwyddau"	Added.
"claimRepaymentType.title"	"What do you want to reclaim?"	"Beth hoffech ei adennill?"	Added.
"claimRepaymentType.heading"	"What do you want to reclaim?"	"Beth hoffech ei adennill?"	Added.
"claimRepaymentType.representative.hint"	"Select all that apply."	"Dewiswch bob un sy’n berthnasol."	Added.
"claimRepaymentType.importer.hint"	"<p>You can check with your shipping courier if you are not sure.</p> <div class=""govuk-hint"">Select all that apply.</div>"	"<p>Gallwch wirio gyda’ch cludwr os nad ydych yn siŵr.</p> <div class=""govuk-hint"">Dewiswch bob un sy’n berthnasol.</div>"	Added.
"claimRepaymentType.01"	"Customs Duty"	"Toll Dramor"	Added.
"claimRepaymentType.02"	"VAT"	"TAW"	Added.
"claimRepaymentType.03"	"Another type of duty"	"Math arall o doll"	Added.
"claimRepaymentType.checkYourAnswersLabel"	"What do you want to reclaim?"	"Beth hoffech ei adennill?"	Added.
"claimRepaymentType.error.required"	"Select what you want to reclaim"	"Dewiswch beth yr hoffech ei adennill"	Added.
"evidenceSupportingDocs.title"	"Required supporting documents"	"Dogfennau ategol angenrheidiol"	Added.
"evidenceSupportingDocs.heading"	"Required supporting documents"	"Dogfennau ategol angenrheidiol"	Added.
"evidenceSupportingDocs.paragraph1"	"These are the documents we must have to process your claim."	"Dyma’r dogfennau y mae’n rhaid i ni eu cael i brosesu’ch hawliad."	Added.
"evidenceSupportingDocs.h2"	"Types of files you can upload"	"Y mathau o ffeiliau y gallwch eu huwchlwytho"	Added.
"evidenceSupportingDocs.checkYourAnswersLabel"	"Supporting documents"	"Dogfennau ategol"	Added.
"evidenceSupportingDocs.error.required"	"Select Supporting documents"	"Dewiswch ddogfennau ategol"	Added.
"claimReason.documents.c88"	"<b>C88</b>, which authorises imports from the country of origin"	"<b>C88</b>, sy’n awdurdodi mewnforion o’r wlad wreiddiol"	Added.
"claimReason.documents.e2"	"<b>E2</b>, which authorises imports from the country of origin"	"<b>E2</b>, sy’n awdurdodi mewnforion o’r wlad wreiddiol"	Added.
"claimReason.documents.commercial_invoice"	"<b>Commercial invoice</b>, which shows the value of the goods"	"<b>Anfoneb fasnachol</b>, sy’n dangos gwerth y nwyddau"	Added.
"claimReason.documents.substitute_entry"	"<b>Substitute entry</b>, which shows changes made to the original entry"	"<b>Cofnod cyfnewid</b>, sy’n dangos newidiadau a wnaed i’r cofnod gwreiddiol"	Added.
"claimReason.documents.currency_charge_evicence"	"Evidence that the invoice has been corrected in another currency"	"Tystiolaeth bod yr anfoneb wedi’i chywiro mewn arian cyfred arall"	Added.
"claimReason.documents.airway_bill"	"<b>Airway bill</b> or <b>bill of lading</b> that show shipping details"	"<b>Bil teithrestr awyr</b> neu <b>bil llwytho</b>, sy’n dangos y manylion cludo"	Added.
"claimReason.documents.proof_of_origin"	"<b>Proof of origin documents</b>, such as a GSP certificate"	"<b>Dogfennau tystiolaeth o darddiad</b>, megis tystysgrif GSP"	Added.
"claimReason.documents.proof_of_quota"	"Proof of the quota and commodity codes that are being claimed against"	"Tystiolaeth o’r cwota a’r codau nwyddau y gwneir hawliad yn eu herbyn"	Added.
"claimReason.documents.proof_of_return"	"Proof of return"	"Prawf o ddychwelyd"	Added.
"claimReason.documents.evidence_of_export"	"Evidence of the original export"	"Tystiolaeth o’r allforio gwreiddiol"	Added.
"claimReason.documents.evidence_of_corrected_invoice"	"Evidence of corrected invoice"	"Tystiolaeth o anfoneb wedi’i chywiro"	Added.
"claimReason.documents.additional.documents.para"	"You may also include additional documents if you think they are relevant."	"Gallwch hefyd gynnwys dogfennau ychwanegol os ydych yn credu eu bod yn berthnasol."	Added.
"declarantReferenceNumber.title"	"Do you want to use your own reference?"	"A hoffech ddefnyddio’ch cyfeirnod eich hun?"	Added.
"declarantReferenceNumber.heading"	"Do you want to use your own reference?"	"A hoffech ddefnyddio’ch cyfeirnod eich hun?"	Added.
"declarantReferenceNumber.hint1"	"This could be an employee reference or something else to help identify who is making this application. We will only include it in letters about this application."	"Gallai hyn fod yn gyfeirnod cyflogai neu’n rhywbeth arall i helpu i amlygu pwy sy’n gwneud y cais hwn. Byddwn ond yn ei gynnwys mewn llythyrau ynghylch y cais hwn."	Added.
"declarantReferenceNumber.hint2"	"You will be given a separate application reference when this application is complete."	"Rhoddir cyfeirnod cais ar wahân i chi pan fydd y cais hwn wedi’i gwblhau."	Added.
"declarantReferenceNumber.01"	"Yes"	"Iawn"	Added.
"declarantReferenceNumber.02"	"No"	"Na"	Added.
"declarantReferenceNumber.checkYourAnswersLabel.answer"	"Your reference"	"Eich cyfeirnod"	Added.
"declarantReferenceNumber.yes.checkYourAnswersLabel"	"Yes"	"Iawn"	Added.
"declarantReferenceNumber.no.checkYourAnswersLabel"	"No"	"Na"	Added.
"declarantReferenceNumber.checkYourAnswersLabel.question"	"Do you want to use your own reference?"	"A hoffech ddefnyddio’ch cyfeirnod eich hun?"	Added.
